{
  "Shipment": {
    "4a96f23d-0f3c-2c96-b3d1-b908984ec709": {
      "proposalCode": "mx4025",

      "comment": "Example of an MXLIMS plate shipment",
      "labContactOutbound": {
        "name": "Bob"
      },
      "labContactReturn": {
        "name": "Bob"
      },
      "version": "0.6.1",
      "mxlimsType": "Shipment",
      "mxlimsBaseType": "LogisticalSample",
      "uuid": "4a96f23d-0f3c-2c96-b3d1-b908984ec709"
    }
  },
  "Plate": {
    "4a96f23a-dce0-2560-baac-f1b23ec9e0cb": {
      "barcode": "9098",
      "plateType": {
        "numberRows": 8,
        "numberColumns": 12,
        "numberSubPositions": 3,
        "dropMapping": "12,3R"
      },
      "containerRef": { "$ref": "#/Shipment/4a96f23d-0f3c-2c96-b3d1-b908984ec709" },
      "version": "0.6.1",
      "mxlimsType": "Plate",
      "mxlimsBaseType": "LogisticalSample",
      "uuid": "4a96f23a-dce0-2560-baac-f1b23ec9e0cb"
    }
  },
  "PlateWell": {
    "4a96f23a-dce0-2560-baac-f1b23ec9e0aa": {
      "rowNumber": 1,
      "columnNumber": 1,
      "containerRef": { "$ref": "#/Plate/4a96f23a-dce0-2560-baac-f1b23ec9e0cb" },
      "version": "0.6.1",
      "mxlimsType": "PlateWell",
      "mxlimsBaseType": "LogisticalSample",
      "uuid": "4a96f23a-dce0-2560-baac-f1b23ec9e0aa"
    }
  },
  "WellDrop": {
    "4a96f23a-dce0-2560-baac-f1b23ec9e0dd": {
      "dropNumber": 1,
      "containerRef": { "$ref": "#/PlateWell/4a96f23a-dce0-2560-baac-f1b23ec9e0aa" },
      "sampleRef": { "$ref": "#/CrystallographicSample/4a96f23a-dce0-2560-baac-f1b23ec9e022" },
      "version": "0.6.1",
      "mxlimsType": "WellDrop",
      "mxlimsBaseType": "LogisticalSample",
      "uuid": "4a96f23a-dce0-2560-baac-f1b23ec9e0dd"
    }
  },
  "CrystallographicSample": {
    "4a96f23a-dce0-2560-baac-f1b23ec9e022": {
      "name": "LMTIM_9098A01d1c1",
      "macromolecule": {
        "acronym": "LMTIM",
        "role": "target"
      },
      "version": "0.6.1",
      "mxlimsType": "CrystallographicSample",
      "mxlimsBaseType": "PreparedSample",
      "uuid": "4a96f23a-dce0-2560-baac-f1b23ec9e022"
    }
  }
}